[
  {
    "id": "jp-hanami",
    "country": "jp",
    "locale": "ja",
    "category": "festival",
    "name": "花見",
    "dateRule": {
      "calendar": "gregorian",
      "recurrence": "yearly",
      "ranges": [{"month": 3, "startDay": 20, "endDay": 31}],
      "timeZone": "Asia/Tokyo"
    },
    "enabled": true,
    "status": "enabled",
    "priority": 10
  },
  {
    "id": "jp-hanami",
    "country": "jp",
    "locale": "ja",
    "category": "festival",
    "name": "Hanami",
    "dateRule": {
      "calendar": "gregorian",
      "recurrence": "yearly",
      "ranges": [{"month": 3, "startDay": 20, "endDay": 31}],
      "timeZone": "Asia/Tokyo"
    },
    "enabled": true,
    "status": "enabled",
    "priority": 10
  }
]
