[
  {
    "id": "jp-christmas",
    "country": "jp",
    "locale": "en",
    "category": "festival",
    "name": "Christmas",
    "description": "The winter holiday season.",
    "dateRule": {"calendar": "gregorian", "recurrence": "yearly", "ranges": [{"month": 12, "startDay": 20, "endDay": 25}], "timeZone": "Asia/Tokyo"},
    "enabled": true,
    "status": "enabled",
    "priority": 50,
    "themeKey": "christmas"
  },
  {
    "id": "jp-halloween",
    "country": "jp",
    "locale": "en",
    "category": "festival",
    "name": "Halloween",
    "description": "An autumn festival of costumes and harvest.",
    "dateRule": {"calendar": "gregorian", "recurrence": "yearly", "ranges": [{"month": 10, "startDay": 28, "endDay": 31}], "timeZone": "Asia/Tokyo"},
    "enabled": true,
    "status": "enabled",
    "priority": 50,
    "themeKey": "halloween"
  },
  {
    "id": "jp-hanami",
    "country": "jp",
    "locale": "en",
    "category": "season",
    "name": "Hanami",
    "description": "A spring seasonal event for enjoying cherry blossoms.",
    "dateRule": {"calendar": "gregorian", "recurrence": "yearly", "ranges": [{"month": 3, "startDay": 20, "endDay": 31}, {"month": 4, "startDay": 1, "endDay": 30}, {"month": 5, "startDay": 1, "endDay": 10}], "timeZone": "Asia/Tokyo"},
    "enabled": true,
    "status": "enabled",
    "priority": 40,
    "themeKey": "hanami"
  },
  {
    "id": "jp-obon",
    "country": "jp",
    "locale": "en",
    "category": "festival",
    "name": "Obon",
    "description": "A traditional summer observance.",
    "dateRule": {"calendar": "gregorian", "recurrence": "yearly", "ranges": [{"month": 8, "startDay": 13, "endDay": 16}], "timeZone": "Asia/Tokyo"},
    "enabled": true,
    "status": "enabled",
    "priority": 40,
    "themeKey": "obon"
  },
  {
    "id": "jp-tsukimi",
    "country": "jp",
    "locale": "en",
    "category": "festival",
    "name": "Tsukimi",
    "description": "An autumn observance for viewing the moon.",
    "dateRule": {"calendar": "lunar", "recurrence": "year-specific", "payload": {"calendarSystem": "traditional-lunar", "source": "catalog-review"}, "timeZone": "Asia/Tokyo", "status": "unsupported-calendar"},
    "enabled": true,
    "status": "unsupported-calendar",
    "priority": 40,
    "themeKey": "tsukimi"
  },
  {
    "id": "jp-tanabata",
    "country": "jp",
    "locale": "en",
    "category": "festival",
    "name": "Tanabata",
    "description": "A summer event for writing wishes on paper strips.",
    "dateRule": {"calendar": "gregorian", "recurrence": "yearly", "ranges": [{"month": 7, "startDay": 1, "endDay": 7}], "timeZone": "Asia/Tokyo"},
    "enabled": true,
    "status": "enabled",
    "priority": 40,
    "themeKey": "tanabata"
  },
  {
    "id": "jp-shogatsu",
    "country": "jp",
    "locale": "en",
    "category": "public-holiday",
    "name": "Shogatsu",
    "description": "The New Year period.",
    "dateRule": {"calendar": "gregorian", "recurrence": "yearly", "ranges": [{"month": 1, "startDay": 1, "endDay": 7}], "timeZone": "Asia/Tokyo"},
    "enabled": true,
    "status": "enabled",
    "priority": 50,
    "themeKey": "shogatsu"
  },
  {
    "id": "jp-kodomo",
    "country": "jp",
    "locale": "en",
    "category": "public-holiday",
    "name": "Children's Day",
    "description": "A holiday wishing for children's healthy growth.",
    "dateRule": {"calendar": "gregorian", "recurrence": "yearly", "ranges": [{"month": 5, "startDay": 1, "endDay": 5}], "timeZone": "Asia/Tokyo"},
    "enabled": true,
    "status": "enabled",
    "priority": 40,
    "themeKey": "kodomo"
  },
  {
    "id": "jp-bunka",
    "country": "jp",
    "locale": "en",
    "category": "public-holiday",
    "name": "Culture Day",
    "description": "A holiday celebrating culture and peace.",
    "dateRule": {"calendar": "gregorian", "recurrence": "yearly", "ranges": [{"month": 11, "startDay": 1, "endDay": 7}], "timeZone": "Asia/Tokyo"},
    "enabled": true,
    "status": "enabled",
    "priority": 40,
    "themeKey": "bunka"
  }
]
